{
  "eventId": "7b0f4c1e-5d52-4a53-9d2f-2f6f0d8e9a11",
  "correlationId": "corr-0001",
  "eventType": "cc.notifications.v1",
  "schemaVersion": 1,
  "occurredAt": "2026-10-17T14:30:00Z",
  "producer": "notification-svc",
  "payload": {
    "applicationId": "APP-0001",
    "noticeType": "ADVERSE_ACTION",
    "channel": "MAIL",
    "recipientRef": "CUST-1001",
    "subject": "Your Maple Northern Bank credit card application",
    "body": "We were unable to approve your application.",
    "reasonTexts": [
      "Credit bureau score below minimum",
      "Debt service ratio too high"
    ]
  }
}
