{
  "eventId": "7b0f4c1e-5d52-4a53-9d2f-2f6f0d8e9a11",
  "correlationId": "corr-0001",
  "eventType": "cc.decisions.declined.v1",
  "schemaVersion": 1,
  "occurredAt": "2026-10-17T14:30:00Z",
  "producer": "decision-orchestrator",
  "payload": {
    "applicationId": "APP-0001",
    "outcome": "DECLINE",
    "creditLimit": 0,
    "product": null,
    "aprTier": null,
    "reasonCodes": [
      "R_LOW_SCORE",
      "R_HIGH_TDS"
    ],
    "firedRules": [
      "elig.age",
      "risk.score_floor",
      "risk.tds_ceiling"
    ],
    "rulesetVersion": "1.0",
    "decidedAt": "2026-10-17T14:30:01Z",
    "processingMillis": 42,
    "applicantSummary": {
      "province": "ON",
      "ageBand": "35-44",
      "bureauScore": 742,
      "tdsRatio": 0.35,
      "annualIncome": 85000
    },
    "rulesetPath": "/ccApprovalApp/1.0/ccApproval/1.0",
    "rulesetDeployedAt": "2026-10-17T12:00:00Z",
    "inputs": {
      "age": 36,
      "province": "ON",
      "residencyStatus": "CITIZEN",
      "employmentStatus": "EMPLOYED",
      "annualIncome": 85000,
      "monthsAtEmployer": 48,
      "monthlyHousingCost": 1800,
      "monthlyDebt": 650,
      "tds": 0.35,
      "creditScore": 742,
      "bankruptcyFlag": false,
      "delinquencies": 0,
      "inquiriesLast6Months": 1,
      "fileAgeMonths": 120,
      "existingCreditLimit": 12000,
      "requestedLimit": 8000,
      "requestedProduct": "CASHBACK",
      "applicantToken": "00000000000000000000000000000001"
    }
  }
}
