{
  "eventId": "7b0f4c1e-5d52-4a53-9d2f-2f6f0d8e9a11",
  "correlationId": "corr-0001",
  "eventType": "cc.decisions.approved.v1",
  "schemaVersion": 1,
  "occurredAt": "2026-10-17T14:30:00Z",
  "producer": "decision-orchestrator",
  "payload": {
    "applicationId": "APP-0001",
    "outcome": "APPROVE",
    "creditLimit": 8000,
    "product": "CASHBACK",
    "aprTier": "TIER_2",
    "reasonCodes": [
      "R_APPROVED_STANDARD"
    ],
    "firedRules": [
      "elig.age",
      "risk.score_band",
      "limit.income_band"
    ],
    "rulesetVersion": "1.0",
    "decidedAt": "2026-10-17T14:30:01Z",
    "processingMillis": 42,
    "applicantSummary": {
      "province": "ON",
      "ageBand": "35-44",
      "bureauScore": 742,
      "tdsRatio": 0.35,
      "annualIncome": 85000
    }
  }
}
