{
  "eventId": "7b0f4c1e-5d52-4a53-9d2f-2f6f0d8e9a11",
  "correlationId": "corr-0001",
  "eventType": "cc.decisions.manual.v1",
  "schemaVersion": 1,
  "occurredAt": "2026-10-17T14:30:00Z",
  "producer": "application-api",
  "payload": {
    "applicationId": "APP-0001",
    "underwriterId": "UW-77",
    "outcome": "APPROVE",
    "creditLimit": 3000,
    "product": "NO_FEE",
    "note": "Verified income by phone.",
    "originalDecisionEventId": "7b0f4c1e-5d52-4a53-9d2f-2f6f0d8e9a11"
  }
}
